Commit_SHA,Branch_Name,Author,Date,Purpose,Status,Risk_Level
6576977ea47b3b2bcb9c79f59a80b5ba2f9575d6,feature/issue-327-executive-dashboard-enhancement,Michael Richard,2025-08-02,Executive Dashboard Enhancement - Task 1.1 Implementation,UNIQUE,LOW
424c880bc929f63460945986255f66c39143af45,feature/issue-327-executive-dashboard-enhancement,Michael Richard,2025-08-02,Complete Week 1 Development Tasks for Issue #327,UNIQUE,LOW
f2d24b611e68dd100d9f7491307edeb45724db7b,feature/issue-327-executive-dashboard-enhancement,Michael Richard,2025-08-02,Complete Integrated Financial System - Issue #327,UNIQUE,MEDIUM
cd517fcc4dc032893d72635b5b19634bbd7225f1,feature/issue-327-executive-dashboard-enhancement,Michael Richard,2025-08-02,Add comprehensive data validation framework and performance monitoring for executive dashboards,UNIQUE,MEDIUM
6c3598bea5bca7e9c15edeabd022396fb5db2922,feature/issue-327-executive-dashboard-enhancement,Michael Richard,2025-08-02,Add Issue #327 completion status update,UNIQUE,LOW
d80afb770338941ab33604d0377d1832fd73365a,develop,Michael Richard,2025-07-15,Fix accessibility tests and address React warnings,UNIQUE,LOW
fcffa9273a4a567b1b7ad404deb0d09b9713e0ba,develop,Michael Richard,2025-07-15,Add weekly project update system with automation,UNIQUE,MEDIUM
0e6f794e579fbe2e18f56d9271b3195763cdfab6,develop,Michael Richard,2025-07-15,Implement Priority 2 features for Q3 2025 delivery cycle,UNIQUE,HIGH
bd6c3e7cab38369b8274ef0c68c7405298407647,feature/product-owner-release-manager-epics,Michael Richard,2025-06-26,Enhance README with GitHub badges and improved discoverability,UNIQUE,LOW
82ac34060fe47b711f3c552d5e5f19696310a945,feature/product-owner-release-manager-epics,Michael Richard,2025-06-26,Add Product Owner and Release Manager role template epics,UNIQUE,MEDIUM
6f51fc972d935d8f4e5ca84ea768140d3141f08c,fix/jsx-syntax,Michael Richard,2025-07-16,Reset TemplateSelector.tsx from origin/develop to resolve syntax error,UNIQUE,HIGH
e28249d5129cb2e98e1d6c20d5808bc8033e9b0b,fix/jsx-syntax,Michael Richard,2025-07-16,Update TDD for zero-task edge case,UNIQUE,LOW
a946805f3f9230954b53c63ab7b22ed1aae89859,fix/jsx-syntax,Michael Richard,2025-07-16,Add demo README for Snowflake Dashboards,UNIQUE,LOW
6597c7c59e37004f3d97b9216a626bb15e898168,fix/jsx-syntax,Michael Richard,2025-07-16,Scaffold React + Plotly frontend for PMO dashboard,UNIQUE,MEDIUM
e5d69f5c56634e60ee825de54422175502d56861,fix/jsx-syntax,Michael Richard,2025-07-16,Add project plan and spec document,UNIQUE,LOW
e1e3183971754bcc40b428578ab1af5a933bbff4,fix/jsx-syntax,Michael Richard,2025-07-16,Add solution modules for backend and frontend,UNIQUE,MEDIUM
5e2cb2bea8cb3e1af7c925306e627e52b28141b8,fix/jsx-syntax,Michael Richard,2025-07-16,Add clean integration test script,UNIQUE,LOW
073ebe66121b5e675e9cfa78427da486cebca7cf,fix/jsx-syntax,Michael Richard,2025-07-16,Update backend and frontend READMEs with setup and test instructions,UNIQUE,LOW
681cf591c35ed4d33ffac8db77131091175f7894,fix/jsx-syntax,Michael Richard,2025-07-16,Add FilterPanel component and integrate in Dashboard,UNIQUE,MEDIUM
441a6b2640c0959e5eb052c448a8c4294e6fa690,fix/jsx-syntax,Michael Richard,2025-07-16,Streamline Dashboard to use mock data and disable source maps,UNIQUE,LOW
74d35b11e8d50fdb60c3d4ec1f8d9a0f18dd5cc1,fix/jsx-syntax,Michael Richard,2025-07-16,Implement Norman UI principles with mapping and WCAG 2.1 AA accessibility,UNIQUE,HIGH
463ea7f1c533fdf9df9ea47234829fa1409358b2,fix/status-reporting-20250722-125719,Michael Richard,2025-07-22,Add proper job conditions and input handling for status-reporting workflow,UNIQUE,MEDIUM
b435510cf440fbd2f407d77ed5caa77120a65acb,fix/status-reporting-20250722-125719,Michael Richard,2025-07-22,Add temporary 2-minute cron for testing workflow execution,UNIQUE,LOW
297ad0bd372014c1b8c7879f48c994884481a998,fix/status-reporting-20250722-125719,Michael Richard,2025-07-22,Enable push events for workflow testing and verification,UNIQUE,LOW
69ccfb38d5e45449587381456aacc19c1d65fb5e,fix/status-reporting-20250722-125719,Michael Richard,2025-07-22,Add simple test workflow for debugging,UNIQUE,LOW
caf73b8d2cdf3fb18bfc071b70da7c1d3e436bbb,fix/status-reporting-20250722-125719,Michael Richard,2025-07-22,Create production-ready status reporting workflow,UNIQUE,HIGH
dbdc2bc8b20f2959eb6d183e47ef19a70988f6e4,feature/add-github-actions-workflow,Michael Richard,2025-06-10,Add comprehensive GitHub Actions workflows and issue templates,UNIQUE,MEDIUM
46827e88b83b8a1999b0a0191cc4e92e9fb1930c,feature/co-authored-enhancement,Michael Richard,2025-06-10,Implement comprehensive PMI IP risk mitigation,UNIQUE,HIGH
9b33c1214386036dc7febf988feb74cadd2c7435,feature/co-authored-enhancement,Michael Richard,2025-06-10,Implement comprehensive liability protection framework,UNIQUE,HIGH
9c81ea11d08793371b7d94408adf5aefadcb353d,feature/co-authored-enhancement,Michael Richard,2025-06-10,Add comprehensive program management enhancement plan,UNIQUE,MEDIUM
6210382d7bf8df67c2b5061685f3727c93420568,feature/co-authored-enhancement,Michael Richard,2025-06-10,Reorganize README with methodology-focused structure and fix broken links,UNIQUE,LOW
a19abbe5c4e3b3c9c3a7d4d4f7a0a1e3e5d4c2a1,feature/co-authored-enhancement,Michael Richard,2025-06-10,Update program manager toolkit links to point to README.md,UNIQUE,LOW
52917978a69eec35dd85f319a96a6f005f7b52c7,fix/add-program-manager-readme,Michael Richard,2025-06-10,Add Program Manager toolkit README files,UNIQUE,LOW
3a8b7cd5c6c8c1fb030f8eac90d1f516f17a6eca,test/monday-morning-email,Michael Richard,2025-06-23,Add env var for testing,UNIQUE,LOW
6681dec761357c35029588c3ffef262165dc5cce,test/monday-morning-email,Michael Richard,2025-06-23,Fix workflow dispatch triggers,UNIQUE,LOW
2355d25d7690550ffbb2f90386e0cdcf3750cf57,test/monday-morning-email,Michael Richard,2025-06-23,Fix workflow dispatch configuration,UNIQUE,LOW
d822f9a2c3226e91b77139b69aa65e6dbaced874,quickfix/readme-title-format,Michael Richard,2025-06-08,Fix README title formatting for consistency,UNIQUE,LOW
64d9cf2cad993e4cf8d0806cbff30ec7f65a33ad,origin/fix-broken-links-readme,Michael Richard,2025-06-09,Fix broken internal links in README.md,UNIQUE,LOW
af24213e0b298eeadf10e0b10663b10c9e688e99,origin/mirichard-patch-1,Michael Richard,2025-06-10,Update README.md,UNIQUE,LOW
